{
	"format": "affrescoui-feature",
	"version": 1,
	"name": "panels",
	"release": "1.0.0",
	"title": "Panels",
	"description": "Problems, Output, Notifications and progress, in the panel and the status bar.",
	"license": "Apache-2.0",
	"note": "Built into Forge: forge.screen.json includes panels.json, and its natives (if any) are compiled in, so this manifest names and versions the package and lists no provides; it is not in the catalogue.",
	"requires": { "format": 1 },
	"provides": {}
}
